{
  "attributes": {
    "component": "target"
  },
  "document_kind": "span",
  "duration_ms": 500,
  "ended_at": "2026-08-06T00:00:00.500Z",
  "input": {
    "prompt": "Buy milk"
  },
  "input_recorded": true,
  "invocation_id": "inv_01890f47-6c20-7a81-b1c8-9e6f12d6406e",
  "name": "invoke target",
  "output": [
    "milk"
  ],
  "output_recorded": true,
  "parent_span_id": "00f067aa0ba902b7",
  "schema_version": "kensa.protocol.v1",
  "span_id": "11f067aa0ba902b7",
  "span_kind": "client",
  "started_at": "2026-08-06T00:00:00.000Z",
  "status": "error",
  "status_message": "Target returned an error",
  "trace_id": "4bf92f3577b34da6a3ce929d0e0e4736"
}
